,BasisOfRec,Binomial,CatalogNo,Citation,CollectID,Compiler,Data_sens,Dec_Lat,Dec_Long,Dist_comm,Event_Year,Origin,Presence,Seasonal,Sens_comm,SpatialRef,YrCompiled,recordedBy
6850,PRESERVED_SPECIMEN,Cupania largifolia,3183222,GBIF,17320,Manuel Vargas,,10.33,-84.03,"Parque Nac. Braulio Carrillo, 15 km SW of Horquetas, W of Rara Avix. Between Río Guácimo and Río Peje.",1989.0,1,1,1,,WGS84,2019,"B. E. Hammel, I. Chacón, C. Gómez, O. Vargas & T. Villalobos"
7791,PRESERVED_SPECIMEN,Cupania largifolia,895589,GBIF,García García 121,Manuel Vargas,,10.88,-85.4,"Parque Nacional Guanacaste, Cordillera de Guanacaste, Estación San Ramón, Sendero El Argentino Dos Ríos",1994.0,1,1,1,,WGS84,2019,Dunia García
11254,PRESERVED_SPECIMEN,Cupania largifolia,2707339,GBIF,Briceño Cerdas 14,Manuel Vargas,,10.880556,-85.418056,Área No Protegida. Dos Ríos. Estación San Ramón. Dos Ríos. Sendero Argentina.,1996.0,1,1,1,,WGS84,2019,Duvalier Briceño
13082,PRESERVED_SPECIMEN,Cupania largifolia,2101555,GBIF,Croat 44507,Manuel Vargas,,10.06,-83.98,"Vicinity of Bajo La Hondura, along road between Paracito and the Río Claro.",1978.0,1,1,1,,WGS84,2019,Thomas B. Croat
14121,PRESERVED_SPECIMEN,Cupania largifolia,172292,GBIF,Haber 9066,Manuel Vargas,,10.366667,-84.81666700000001,5 km N Monteverde at Río Negro on road to Finca San Bosco. Atlantic slope.,1989.0,1,1,1,,WGS84,2019,William A. Haber|Willow Zuchowski
15996,PRESERVED_SPECIMEN,Cupania largifolia,100520592,GBIF,Santamaría-Aguilar 1818,Manuel Vargas,,10.236388999999999,-84.117778,R.F. Cordillera Volcánica Central.  Cuenca del Sarapiquí.  9 km NE de la casa de Pablo Serrano.  Proyecto ALAS.,2005.0,1,1,1,,WGS84,2019,Daniel Santamaría
16189,PRESERVED_SPECIMEN,Cupania largifolia,100493053,GBIF,Kriebel Haehner 1250,Manuel Vargas,,10.143056,-84.160556,No protegida.  Cuenca del Tárcoles.  Posada Volcán Poás.,2002.0,1,1,1,,WGS84,2019,Ricardo Kriebel
17326,PRESERVED_SPECIMEN,Cupania largifolia,4315003,GBIF,,Manuel Vargas,,10.163889,-83.940278,"P. N. Braulio Carrillo. Puesto Quebrada González, Sendero Las Palmas.",2006.0,1,1,1,,WGS84,2019,L. Acosta; Luis Diego Vargas ; Guillermo Villalobos ; Federico Solano
19204,PRESERVED_SPECIMEN,Cupania largifolia,4027120,GBIF,,Manuel Vargas,,10.236388999999999,-84.117778,"9km NE de Vara Blanca, Finca Murillo, Transecto INBio-OET-ALAS.",2005.0,1,1,1,,WGS84,2019,Daniel Santamaría
19207,PRESERVED_SPECIMEN,Cupania largifolia,4027119,GBIF,,Manuel Vargas,,10.236388999999999,-84.117778,"9km NE de Vara Blanca, Finca Murillo, Transecto INBio-OET-ALAS.",2005.0,1,1,1,,WGS84,2019,Daniel Santamaría
19208,PRESERVED_SPECIMEN,Cupania largifolia,4027121,GBIF,,Manuel Vargas,,10.236388999999999,-84.117778,"9km NE de Vara Blanca, Finca Murillo, Transecto INBio-OET-ALAS.",2005.0,1,1,1,,WGS84,2019,Daniel Santamaría
19604,PRESERVED_SPECIMEN,Cupania largifolia,3907314,GBIF,,Manuel Vargas,,10.143056,-84.160556,"Los Cartagos a Vara Blanca, cabeceras Rio Tambor.",2002.0,1,1,1,,WGS84,2019,Ricardo Kriebel
19605,PRESERVED_SPECIMEN,Cupania largifolia,3907311,GBIF,,Manuel Vargas,,10.143056,-84.160556,"Los Cartagos a Vara Blanca, cabeceras Rio Tambor.",2002.0,1,1,1,,WGS84,2019,Ricardo Kriebel
19606,PRESERVED_SPECIMEN,Cupania largifolia,3907316,GBIF,,Manuel Vargas,,10.143056,-84.160556,"Los Cartagos a Vara Blanca, cabeceras Rio Tambor.",2002.0,1,1,1,,WGS84,2019,Ricardo Kriebel
19607,PRESERVED_SPECIMEN,Cupania largifolia,3907309,GBIF,,Manuel Vargas,,10.143056,-84.160556,"Los Cartagos a Vara Blanca, cabeceras Rio Tambor.",2002.0,1,1,1,,WGS84,2019,Ricardo Kriebel
19608,PRESERVED_SPECIMEN,Cupania largifolia,3907310,GBIF,,Manuel Vargas,,10.143056,-84.160556,"Los Cartagos a Vara Blanca, cabeceras Rio Tambor.",2002.0,1,1,1,,WGS84,2019,Ricardo Kriebel
21734,PRESERVED_SPECIMEN,Cupania largifolia,2917582,GBIF,,Manuel Vargas,,10.366667,-84.81666700000001,5 km N Monteverde at Rio Negro on road to Finca San Bosco. Atlantic slope.,1989.0,1,1,1,,WGS84,2019,William Haber
23293,PRESERVED_SPECIMEN,Cupania largifolia,1571411,GBIF,,Manuel Vargas,,10.880556,-85.401389,Estacion San Ramon. Sendero El Argentino Dos Rios.,1994.0,1,1,1,,WGS84,2019,Dunia Garcia
23814,PRESERVED_SPECIMEN,Cupania largifolia,1515982,GBIF,,Manuel Vargas,,10.880556,-85.40139,Estacion San Ramon. Dos Rios. Sendero Argentina.,1996.0,1,1,1,,WGS84,2019,Duvalier Briceño
24743,PRESERVED_SPECIMEN,Cupania largifolia,V0304456F,GBIF,,Manuel Vargas,,3.8811,-72.8667,,,1,1,1,,WGS84,2019,
28768,PRESERVED_SPECIMEN,Cupania largifolia,204825,GBIF,,Manuel Vargas,,8.7,-83.5,"Aguabuena, 3 km W of Rincón. One hectare permanent sample plot 800 m N of house of Henry Monge in well-drainage. moderately sloping terrain. Tall forest along timber road, leaf after selective logging March 1992.",1995.0,1,1,1,,WGS84,2019,"Thomsen, Karsten"
