,BasisOfRec,Binomial,CatalogNo,Citation,CollectID,Compiler,Data_sens,Dec_Lat,Dec_Long,Dist_comm,Event_Year,Origin,Presence,Seasonal,Sens_comm,SpatialRef,YrCompiled,recordedBy
2878,PRESERVED_SPECIMEN,Gonzalagunia brenesii,100954934,GBIF,Lobo Cabezas 770,Manuel Vargas,,9.563889,-84.123611,San Carlos. R.B. Rios Paraiso. Bajos de la Virgen. Sendero que va a las termales.,2004.0,1,1,1,,WGS84,2019,Silvia Lobo|Alexander Rojas
3611,PRESERVED_SPECIMEN,Gonzalagunia brenesii,0103228,GBIF,,Manuel Vargas,,8.68333,-83.2,"Costa Rica: Prov. Puntarenas, Ref. Golfito, ca. 2 km from Golfito in direction to Gambas, sendero, 200–300 m. s.m.",1992.0,1,1,1,,WGS84,2019,"Kiehn,M., Kiehn,M. & Lux,M."
3612,PRESERVED_SPECIMEN,Gonzalagunia brenesii,0103229,GBIF,,Manuel Vargas,,8.68333,-83.2,"Costa Rica: Prov. Puntarenas, Ref. Golfito, ca. 2 km from Golfito in direction to Gambas, sendero, 200–300 m. s.m.",1992.0,1,1,1,,WGS84,2019,"Kiehn,M., Kiehn,M. & Lux,M."
3656,PRESERVED_SPECIMEN,Gonzalagunia brenesii,MA-01-00758615,GBIF,1349,Manuel Vargas,,9.5106,-84.0408,"San José: Tarrazú. No protegida. Cuenca del Naranjo y Paquita. Esquipulas, camino a San Marcos de Tarrazú.",2001.0,1,1,1,,WGS84,2019,L. González & al.
3888,PRESERVED_SPECIMEN,Gonzalagunia brenesii,01095626,GBIF,12202,Manuel Vargas,,8.6761,-83.5214,"Distrito: Sierpe. Reserva Forestal Golfo Dulce. Rincón, camino a Rancho Quemado,  Quebrada La Bonga entre Banegas y Baneguitas, muestras hecha a orillas del camino y arriba de la Q. La Bonga en la finca de don Alexander Solorzano",2009.0,1,1,1,,WGS84,2019,R. Aguilar
5908,PRESERVED_SPECIMEN,Gonzalagunia brenesii,0082692,GBIF,,Manuel Vargas,,8.69,-83.18083,"Costa Rica, Puntarenas Province, Canton Golfito. Vicinity of La Gamba, Valle La Bolsa, Rio La Bolsa ca. 100 m behind last oil-palm plantations.",2015.0,1,1,1,,WGS84,2019,"Berger,A."
6057,PRESERVED_SPECIMEN,Gonzalagunia brenesii,3311549,GBIF,94-3850,Manuel Vargas,,8.6458,-83.1789,"Puntarena: Golfito, Refugio Nacional de Vida Silvestre Golfito, 3-6 km from Zona Franca near Golfito along road to la Esquina",1994.0,1,1,1,,WGS84,2019,W. J. Kress & R. Calderon
6502,PRESERVED_SPECIMEN,Gonzalagunia brenesii,RB00753574,GBIF,,Manuel Vargas,,8.683333,-83.216667,Province Puntarenas Region Golfito Seccion Bosque de los Austriacos-La Gamba. Gap near the Research plot.,,1,1,1,,WGS84,2019,W. Hubber; A. Weissenhofer
7729,PRESERVED_SPECIMEN,Gonzalagunia brenesii,898309,GBIF,Aguilar Fernández 2850,Manuel Vargas,,8.566667,-83.516667,"P.N. Corcovado; Península de Osa. Estación Los Patos, Cerro de Oro, junto a la Estación.",1993.0,1,1,1,,WGS84,2019,Reinaldo Aguilar
7944,PRESERVED_SPECIMEN,Gonzalagunia brenesii,888746,GBIF,Fernández Zúñiga 209,Manuel Vargas,,8.65,-83.15,"R.N.V.S. Golfito; Valle de Coto Colorado. Camino a las Torres del I.C.E., aprox. 2 km antes de llegar.",1992.0,1,1,1,,WGS84,2019,Álvaro Fernández
8724,PRESERVED_SPECIMEN,Gonzalagunia brenesii,542388,GBIF,Croat 67595,Manuel Vargas,,8.65,-83.18333,"Along gravel road to microwave tower above Golfito, 0.7 m above main road",1987.0,1,1,1,,WGS84,2019,Thomas B. Croat
8953,PRESERVED_SPECIMEN,Gonzalagunia brenesii,530932,GBIF,Kernan 495,Manuel Vargas,,8.45,-83.55,Parque Nacional Corcovado El Tigre/ Cerro Mueller.,1988.0,1,1,1,,WGS84,2019,Christopher Kernan|Pamela Phillips
9141,PRESERVED_SPECIMEN,Gonzalagunia brenesii,522132,GBIF,Marín Alpízar 171,Manuel Vargas,,8.76,-83.6,Estero Guerra. Sierpe. Fincas que se encuentran al este del Estero.,1991.0,1,1,1,,WGS84,2019,Juan Marín
9221,PRESERVED_SPECIMEN,Gonzalagunia brenesii,518712,GBIF,Aguilar Fernández 775,Manuel Vargas,,8.73,-83.4,Reserva Forestal Golfo Dulce Punta Camíbar hasta Punta Islotes. Rincón de Osa.,1991.0,1,1,1,,WGS84,2019,Reinaldo Aguilar
9539,PRESERVED_SPECIMEN,Gonzalagunia brenesii,511376,GBIF,Gómez-Laurito 11578,Manuel Vargas,,9.48,-84.05,"Faldas del Cerro Nara, ca. Esquipulas, límite Quepos (Puntarenas) y Tarrazú.",1987.0,1,1,1,,WGS84,2019,Jorge Gómez-Laurito|J.A. López|Hernán Gómez
9595,PRESERVED_SPECIMEN,Gonzalagunia brenesii,507774,GBIF,Grayum 6027,Manuel Vargas,,8.68,-82.94,"Forests on main ridge and NE slopes of Fila de Cal, between San Vito and Ciudad Neily. 8º41'N, 82º56.5'W. Elev. ca. 500-620 m.",1985.0,1,1,1,,WGS84,2019,Michael H. Grayum|Gerardo Herrera Ch.|José Berrocal|Pamela J. Sleeper
12625,PRESERVED_SPECIMEN,Gonzalagunia brenesii,2274060,GBIF,Will s.n.,Manuel Vargas,,8.68333,-83.21666,"Province La Gamba, Parque National Esquinas connection trail Golfito/La Gamba ( 8km long)",1999.0,1,1,1,,WGS84,2019,Sabine Will
12633,PRESERVED_SPECIMEN,Gonzalagunia brenesii,2273569,GBIF,Burch 4416,Manuel Vargas,,8.693610000000001,-83.47583,River bank near field statiom Rincon de Osa,1971.0,1,1,1,,WGS84,2019,Derek  Burch
12638,PRESERVED_SPECIMEN,Gonzalagunia brenesii,2273344,GBIF,Burger 5490,Manuel Vargas,,8.7,-83.51,"Forested area near the airfield about 4 miles west of Rincon de Osa, Osa Peninsula",1968.0,1,1,1,,WGS84,2019,William C. Burger|Robert G. Stolze
12639,PRESERVED_SPECIMEN,Gonzalagunia brenesii,2273265,GBIF,Raven 21474,Manuel Vargas,,8.69,-83.5,"Primary forest and forest margins along the Camino al Pacifico, west of Rincón de Osa, Osa Peninsula",1967.0,1,1,1,,WGS84,2019,Peter H. Raven
14142,PRESERVED_SPECIMEN,Gonzalagunia brenesii,1714179,GBIF,Gentry 1212,Manuel Vargas,,8.65361,-83.48388,"Osa Peninsula near Rincón, road to Finca Sucio",1971.0,1,1,1,,WGS84,2019,Alwyn H. Gentry
14261,PRESERVED_SPECIMEN,Gonzalagunia brenesii,1577149,GBIF,Duke 16120,Manuel Vargas,,8.69,-83.5,Tropical wet forest along dry stream bed paralleling airport at Rincon. Ann. rainfall ca 180 inches.,1969.0,1,1,1,,WGS84,2019,James A. Duke
14329,PRESERVED_SPECIMEN,Gonzalagunia brenesii,1520033,GBIF,Azofeifa Azofeifa 324,Manuel Vargas,,8.52,-83.42,"Peninsula de Osa, P.N. Corcovado. Rio Tigre, Rio Agujas Estacion Agujas.",1997.0,1,1,1,,WGS84,2019,Alejandro Azofeifa
14330,PRESERVED_SPECIMEN,Gonzalagunia brenesii,1520041,GBIF,Vargas Ramírez 453,Manuel Vargas,,9.77,-84.53,Valle del Tarcoles. Cabinas Vina del Mar.,1994.0,1,1,1,,WGS84,2019,Orlando Vargas
14367,PRESERVED_SPECIMEN,Gonzalagunia brenesii,1499785,GBIF,Fletes Almengor 342,Manuel Vargas,,8.67,-83.2,R.F. Golfo Dulce. serranias de Golfito. Estacion Rio Bonito.,1997.0,1,1,1,,WGS84,2019,Eida Fletes
14639,PRESERVED_SPECIMEN,Gonzalagunia brenesii,1417411,GBIF,Allen 5643,Manuel Vargas,,8.54,-82.84,vicinity Delta of the Rio Esquinas. Golfo Dulce.,1950.0,1,1,1,,WGS84,2019,Paul H. Allen
15065,PRESERVED_SPECIMEN,Gonzalagunia brenesii,1260842,GBIF,Gamboa Romero 218,Manuel Vargas,,9.02,-82.96,Estacion Pittier. Sendero a Rio Canasta. Bosque Secundario.,1995.0,1,1,1,,WGS84,2019,Billen Gamboa R.
15566,PRESERVED_SPECIMEN,Gonzalagunia brenesii,100893175,GBIF,Berger 1746,Manuel Vargas,,8.69,-83.18083299999999,"Vicinity of La Gamba, Valle La Bolsa, Rio La Bolsa ca. 100 m behind last oil-palm plantations.",2015.0,1,1,1,,WGS84,2019,A. Berger
15707,PRESERVED_SPECIMEN,Gonzalagunia brenesii,100672745,GBIF,Rodríguez González 4812,Manuel Vargas,,8.683333,-83.56666700000001,"R.F. Golfo Dulce, Peninsula de Osa. Camino entre Rancho Quemado y Drake.",1999.0,1,1,1,,WGS84,2019,Alexánder Rodríguez|Luis Diego Vargas|Víctor H. Ramírez
15853,PRESERVED_SPECIMEN,Gonzalagunia brenesii,100579823,GBIF,Hammel 22834,Manuel Vargas,,8.7,-83.6,R.F. Golfo Dulce. Cuenca Térraba-Sierpe. Fila entre Rancho Quemado y Drake.,2003.0,1,1,1,,WGS84,2019,Barry E. Hammel|et al.
16149,PRESERVED_SPECIMEN,Gonzalagunia brenesii,100500341,GBIF,Solano Peralta 846,Manuel Vargas,,8.65618,-83.18056,"R.V.S. Golfito. Serranías de Golfito. R.F. Golfito, La Tigra, camino a la catarata.",2004.0,1,1,1,,WGS84,2019,Daniel Solano
17184,PRESERVED_SPECIMEN,Gonzalagunia brenesii,4355914,GBIF,,Manuel Vargas,,8.673611,-83.188889,3 Km al norte del aeropuerto. Sendero natural.,2002.0,1,1,1,,WGS84,2019,Reinaldo Aguilar
17185,PRESERVED_SPECIMEN,Gonzalagunia brenesii,4355913,GBIF,,Manuel Vargas,,8.673611,-83.188889,3 Km al norte del aeropuerto. Sendero natural.,2002.0,1,1,1,,WGS84,2019,Reinaldo Aguilar
17512,PRESERVED_SPECIMEN,Gonzalagunia brenesii,4285000,GBIF,,Manuel Vargas,,8.645639,-83.165778,RNVS Golfito.,2011.0,1,1,1,,WGS84,2019,Luis Diego Vargas; Guillermo Villalobos ; Daniel Santamaría
17513,PRESERVED_SPECIMEN,Gonzalagunia brenesii,4284999,GBIF,,Manuel Vargas,,8.645639,-83.165778,RNVS Golfito.,2011.0,1,1,1,,WGS84,2019,Luis Diego Vargas; Guillermo Villalobos ; Daniel Santamaría
17514,PRESERVED_SPECIMEN,Gonzalagunia brenesii,4284997,GBIF,,Manuel Vargas,,8.645639,-83.165778,RNVS Golfito.,2011.0,1,1,1,,WGS84,2019,Luis Diego Vargas; Guillermo Villalobos ; Daniel Santamaría
17515,PRESERVED_SPECIMEN,Gonzalagunia brenesii,4284998,GBIF,,Manuel Vargas,,8.645639,-83.165778,RNVS Golfito.,2011.0,1,1,1,,WGS84,2019,Luis Diego Vargas; Guillermo Villalobos ; Daniel Santamaría
18967,PRESERVED_SPECIMEN,Gonzalagunia brenesii,4062898,GBIF,,Manuel Vargas,,9.560556,-84.123611,"Tarrazú, San Carlos; Bajo de la Virgen, areas perturbadas junto a camino que va hacia ""Cerros"" de Quepos.",2003.0,1,1,1,,WGS84,2019,Jose González
18968,PRESERVED_SPECIMEN,Gonzalagunia brenesii,4062899,GBIF,,Manuel Vargas,,9.560556,-84.123611,"Tarrazú, San Carlos; Bajo de la Virgen, areas perturbadas junto a camino que va hacia ""Cerros"" de Quepos.",2003.0,1,1,1,,WGS84,2019,Jose González
19167,PRESERVED_SPECIMEN,Gonzalagunia brenesii,4030487,GBIF,,Manuel Vargas,,8.65618,-83.180561,R.N.V.S. Golfito. Estación Naranjal. Sendero Catarata,2004.0,1,1,1,,WGS84,2019,Daniel Solano
19168,PRESERVED_SPECIMEN,Gonzalagunia brenesii,4030485,GBIF,,Manuel Vargas,,8.65618,-83.180561,R.N.V.S. Golfito. Estación Naranjal. Sendero Catarata,2004.0,1,1,1,,WGS84,2019,Daniel Solano
19169,PRESERVED_SPECIMEN,Gonzalagunia brenesii,4030486,GBIF,,Manuel Vargas,,8.65618,-83.180561,R.N.V.S. Golfito. Estación Naranjal. Sendero Catarata,2004.0,1,1,1,,WGS84,2019,Daniel Solano
19170,PRESERVED_SPECIMEN,Gonzalagunia brenesii,4030483,GBIF,,Manuel Vargas,,8.65618,-83.180561,R.N.V.S. Golfito. Estación Naranjal. Sendero Catarata,2004.0,1,1,1,,WGS84,2019,Daniel Solano
19172,PRESERVED_SPECIMEN,Gonzalagunia brenesii,4030484,GBIF,,Manuel Vargas,,8.65618,-83.180561,R.N.V.S. Golfito. Estación Naranjal. Sendero Catarata,2004.0,1,1,1,,WGS84,2019,Daniel Solano
19554,PRESERVED_SPECIMEN,Gonzalagunia brenesii,3910804,GBIF,,Manuel Vargas,,8.7,-83.6,High forest W of Rancho Quemado on road to Drake and new logging road.,2003.0,1,1,1,,WGS84,2019,Barry Hammel; Isabel Pérez ; J. Salazar
19555,PRESERVED_SPECIMEN,Gonzalagunia brenesii,3910803,GBIF,,Manuel Vargas,,8.7,-83.6,High forest W of Rancho Quemado on road to Drake and new logging road.,2003.0,1,1,1,,WGS84,2019,Barry Hammel; Isabel Pérez ; J. Salazar
19556,PRESERVED_SPECIMEN,Gonzalagunia brenesii,3910806,GBIF,,Manuel Vargas,,8.7,-83.6,High forest W of Rancho Quemado on road to Drake and new logging road.,2003.0,1,1,1,,WGS84,2019,Barry Hammel; Isabel Pérez ; J. Salazar
19559,PRESERVED_SPECIMEN,Gonzalagunia brenesii,3910805,GBIF,,Manuel Vargas,,8.7,-83.6,High forest W of Rancho Quemado on road to Drake and new logging road.,2003.0,1,1,1,,WGS84,2019,Barry Hammel; Isabel Pérez ; J. Salazar
20412,PRESERVED_SPECIMEN,Gonzalagunia brenesii,3418993,GBIF,,Manuel Vargas,,8.662222,-83.199722,"La Montura, Sendero La Gamba.",2000.0,1,1,1,,WGS84,2019,L. Acosta; Gerardo Soto ; Geovanny Sancho
20414,PRESERVED_SPECIMEN,Gonzalagunia brenesii,3418994,GBIF,,Manuel Vargas,,8.662222,-83.199722,"La Montura, Sendero La Gamba.",2000.0,1,1,1,,WGS84,2019,L. Acosta; Gerardo Soto ; Geovanny Sancho
20416,PRESERVED_SPECIMEN,Gonzalagunia brenesii,3418991,GBIF,,Manuel Vargas,,8.662222,-83.199722,"La Montura, Sendero La Gamba.",2000.0,1,1,1,,WGS84,2019,L. Acosta; Gerardo Soto ; Geovanny Sancho
20417,PRESERVED_SPECIMEN,Gonzalagunia brenesii,3418992,GBIF,,Manuel Vargas,,8.662222,-83.199722,"La Montura, Sendero La Gamba.",2000.0,1,1,1,,WGS84,2019,L. Acosta; Gerardo Soto ; Geovanny Sancho
20657,PRESERVED_SPECIMEN,Gonzalagunia brenesii,3409401,GBIF,,Manuel Vargas,,9.510556,-84.04083299999999,"Esquipulas, camino a San Marcos de Tarrazú.",2001.0,1,1,1,,WGS84,2019,Luis González; Rafael Chacón ; R. Chavez
20658,PRESERVED_SPECIMEN,Gonzalagunia brenesii,3409402,GBIF,,Manuel Vargas,,9.510556,-84.04083299999999,"Esquipulas, camino a San Marcos de Tarrazú.",2001.0,1,1,1,,WGS84,2019,Luis González; Rafael Chacón ; R. Chavez
20659,PRESERVED_SPECIMEN,Gonzalagunia brenesii,3408686,GBIF,,Manuel Vargas,,9.510556,-84.04083299999999,"Esquipulas, camino a San Marcos de Tarrazú.",2001.0,1,1,1,,WGS84,2019,Luis González; Rafael Chacón ; R. Chavez
20660,PRESERVED_SPECIMEN,Gonzalagunia brenesii,3408684,GBIF,,Manuel Vargas,,9.510556,-84.04083299999999,"Esquipulas, camino a San Marcos de Tarrazú.",2001.0,1,1,1,,WGS84,2019,Luis González; Rafael Chacón ; R. Chavez
20661,PRESERVED_SPECIMEN,Gonzalagunia brenesii,3408685,GBIF,,Manuel Vargas,,9.510556,-84.04083299999999,"Esquipulas, camino a San Marcos de Tarrazú.",2001.0,1,1,1,,WGS84,2019,Luis González; Rafael Chacón ; R. Chavez
20662,PRESERVED_SPECIMEN,Gonzalagunia brenesii,3408683,GBIF,,Manuel Vargas,,9.510556,-84.04083299999999,"Esquipulas, camino a San Marcos de Tarrazú.",2001.0,1,1,1,,WGS84,2019,Luis González; Rafael Chacón ; R. Chavez
21098,PRESERVED_SPECIMEN,Gonzalagunia brenesii,3107102,GBIF,,Manuel Vargas,,8.683333,-83.56666700000001,Rancho Quemado.,1999.0,1,1,1,,WGS84,2019,Alexánder Francisco Rodríguez González; Luis Diego Vargas ; Victor Ramírez
21099,PRESERVED_SPECIMEN,Gonzalagunia brenesii,3107105,GBIF,,Manuel Vargas,,8.683333,-83.56666700000001,Rancho Quemado.,1999.0,1,1,1,,WGS84,2019,Alexánder Francisco Rodríguez González; Luis Diego Vargas ; Victor Ramírez
21100,PRESERVED_SPECIMEN,Gonzalagunia brenesii,3107104,GBIF,,Manuel Vargas,,8.683333,-83.56666700000001,Rancho Quemado.,1999.0,1,1,1,,WGS84,2019,Alexánder Francisco Rodríguez González; Luis Diego Vargas ; Victor Ramírez
21101,PRESERVED_SPECIMEN,Gonzalagunia brenesii,3107103,GBIF,,Manuel Vargas,,8.683333,-83.56666700000001,Rancho Quemado.,1999.0,1,1,1,,WGS84,2019,Alexánder Francisco Rodríguez González; Luis Diego Vargas ; Victor Ramírez
21486,PRESERVED_SPECIMEN,Gonzalagunia brenesii,2905775,GBIF,,Manuel Vargas,,8.733333,-83.40916700000001,Punta Camibar hasta Punta Islotes.,1991.0,1,1,1,,WGS84,2019,Reinaldo Aguilar
21582,PRESERVED_SPECIMEN,Gonzalagunia brenesii,2924286,GBIF,,Manuel Vargas,,8.504541,-83.471399,Cerro Mueller,1988.0,1,1,1,,WGS84,2019,C. Kernan
22652,PRESERVED_SPECIMEN,Gonzalagunia brenesii,1605562,GBIF,,Manuel Vargas,,8.7,-83.516669,Cerro de Oro. Sendero La Tarde. Bosque secundario.,1995.0,1,1,1,,WGS84,2019,Billen Gamboa R.
22659,PRESERVED_SPECIMEN,Gonzalagunia brenesii,1605402,GBIF,,Manuel Vargas,,8.566667,-83.516667,"Estacion Los Patos, Cerro de Oro, junto a la Estacion.",1993.0,1,1,1,,WGS84,2019,Reinaldo Aguilar
22785,PRESERVED_SPECIMEN,Gonzalagunia brenesii,1601377,GBIF,,Manuel Vargas,,8.7,-83.516669,Cerro de Oro. Sendero La Tarde.,1995.0,1,1,1,,WGS84,2019,Marcos Moraga
23536,PRESERVED_SPECIMEN,Gonzalagunia brenesii,1563870,GBIF,,Manuel Vargas,,8.656944000000001,-83.156944,"Camino a las Torres del I.C.E., aprox. 2 Km antes de llegar.",1992.0,1,1,1,,WGS84,2019,Alvaro Fernandez
23769,PRESERVED_SPECIMEN,Gonzalagunia brenesii,1554086,GBIF,,Manuel Vargas,,8.766667,-83.602778,Estero Guerra. Sierpe. Fincas que se encuentran al este del Estero.,1991.0,1,1,1,,WGS84,2019,Juan Marin
23889,PRESERVED_SPECIMEN,Gonzalagunia brenesii,1510429,GBIF,,Manuel Vargas,,9.777778,-84.536111,Cabinas Vina del Mar. 200 m. de la playa.,1994.0,1,1,1,,WGS84,2019,Orlando Vargas
23961,PRESERVED_SPECIMEN,Gonzalagunia brenesii,1531651,GBIF,,Manuel Vargas,,8.672222,-83.206944,"Sendero natural al oeste de la Fila Gamba, 3 km al norte del aereopuerto.",1997.0,1,1,1,,WGS84,2019,Eida Fletes
23962,PRESERVED_SPECIMEN,Gonzalagunia brenesii,1531652,GBIF,,Manuel Vargas,,8.672222,-83.206944,"Sendero natural al oeste de la Fila Gamba, 3 km al norte del aereopuerto.",1997.0,1,1,1,,WGS84,2019,Eida Fletes
24033,PRESERVED_SPECIMEN,Gonzalagunia brenesii,1527921,GBIF,,Manuel Vargas,,8.525,-83.427778,Estacion El Tigre. Alrededores entre 200 y 300 msnm,1997.0,1,1,1,,WGS84,2019,Alejandro Azofeifa Zúñiga
24034,PRESERVED_SPECIMEN,Gonzalagunia brenesii,1527920,GBIF,,Manuel Vargas,,8.525,-83.427778,Estacion El Tigre. Alrededores entre 200 y 300 msnm,1997.0,1,1,1,,WGS84,2019,Alejandro Azofeifa Zúñiga
24035,PRESERVED_SPECIMEN,Gonzalagunia brenesii,1527922,GBIF,,Manuel Vargas,,8.525,-83.427778,Estacion El Tigre. Alrededores entre 200 y 300 msnm,1997.0,1,1,1,,WGS84,2019,Alejandro Azofeifa Zúñiga
24569,PRESERVED_SPECIMEN,Gonzalagunia brenesii,,GBIF,5643,Manuel Vargas,,10.0,-84.8333,,1950.0,1,1,1,,WGS84,2019,P. H. Allen
24664,PRESERVED_SPECIMEN,Gonzalagunia brenesii,V0069273F,GBIF,,Manuel Vargas,,10.0114,-83.9519,,1930.0,1,1,1,,WGS84,2019,A. M. Brenes
25250,PRESERVED_SPECIMEN,Gonzalagunia brenesii,G-G-144628/1,GBIF,,Manuel Vargas,,8.68333,-83.56667,Puntarenas - Puntarenas: Osa. R. F. Golfo Dulce. Península de Osa. Camino entre Rancho Quemado y Drake/Provincia de Puntarenas,1999.0,1,1,1,,WGS84,2019,"Rodríguez, A., L. D. Vargas & V. H. Ramírez"
25352,PRESERVED_SPECIMEN,Gonzalagunia brenesii,0023782,GBIF,,Manuel Vargas,,8.68333,-83.2,"Costa Rica, Puntarenas, Golfito. P. N. Piedras Blancas, Way from La Gamba to Golfito. 8°41'N, 83°13'W, 100 m",2000.0,1,1,1,,WGS84,2019,"Huber,W. & Weissenhofer,A."
25353,PRESERVED_SPECIMEN,Gonzalagunia brenesii,0023962,GBIF,,Manuel Vargas,,8.68333,-83.2,"Costa Rica, Puntarenas, Golfito. P. N. Piedras Blancas. Way from La Gamba to Golfito. 8°41'N, 83°13'W, 60 m",2000.0,1,1,1,,WGS84,2019,"Huber,W. & Weissenhofer,A."
26413,PRESERVED_SPECIMEN,Gonzalagunia brenesii,2488,GBIF,,Manuel Vargas,,8.679917,-82.93605600000001,,,1,1,1,,WGS84,2019,
28531,PRESERVED_SPECIMEN,Gonzalagunia brenesii,242587,GBIF,,Manuel Vargas,,9.56,-84.12,R. B. Ríos Paraíso Bajos de la Virgen.,2004.0,1,1,1,,WGS84,2019,"Sánchez, Joaquín"
28532,PRESERVED_SPECIMEN,Gonzalagunia brenesii,240926,GBIF,,Manuel Vargas,,8.68,-83.56,R.F. Golfo Dulce Península de Osa. Camino entre Rancho Quemado y drake.,1999.0,1,1,1,,WGS84,2019,"Rodríguez, Alexánder"
28533,PRESERVED_SPECIMEN,Gonzalagunia brenesii,239845,GBIF,,Manuel Vargas,,9.56,-84.12,R.B. Ríos Paraíso Bajos de la Virgen. Sendero que va a las termales.,2004.0,1,1,1,,WGS84,2019,"Lobo, Silvia"
28534,PRESERVED_SPECIMEN,Gonzalagunia brenesii,239364,GBIF,,Manuel Vargas,,9.56,-84.12,R. B. Ríos Paraiso,2004.0,1,1,1,,WGS84,2019,"Ruiz, Armando"
28535,PRESERVED_SPECIMEN,Gonzalagunia brenesii,236647,GBIF,,Manuel Vargas,,8.67,-85.19,"R. N. V. S. Golfito Valle de Coto Colorado. Fila Gamba, sendero hacia las torres de comunicación",1998.0,1,1,1,,WGS84,2019,"Gómez Laurito, Jorge"
28537,PRESERVED_SPECIMEN,Gonzalagunia brenesii,232865,GBIF,,Manuel Vargas,,8.68,-83.21,P. N. Piedras Blancas Way from La Gamba to Golfito.,,1,1,1,,WGS84,2019,"Huber, Werner"
28538,PRESERVED_SPECIMEN,Gonzalagunia brenesii,232853,GBIF,,Manuel Vargas,,8.68,-83.21,P. N. Piedras Blancas Way from La Gamba to Golfito.,2000.0,1,1,1,,WGS84,2019,"Huber, Werner"
28542,PRESERVED_SPECIMEN,Gonzalagunia brenesii,214376,GBIF,,Manuel Vargas,,8.56,-83.51,"P. N. Corcovado Península de Osa. Estación Los Patos. Cerro de Oro, junto a la estación.",,1,1,1,,WGS84,2019,"Aguilar, Reinaldo"
28543,PRESERVED_SPECIMEN,Gonzalagunia brenesii,213228,GBIF,,Manuel Vargas,,8.64,-83.17,"R.V. S. Golfito 3 km from Zona Franca, near Golfito, along road to La Esquina.",1994.0,1,1,1,,WGS84,2019,"Kress, W. John"
28546,PRESERVED_SPECIMEN,Gonzalagunia brenesii,193787,GBIF,,Manuel Vargas,,8.64,-83.17,"R. N. V. S. Golfito 3-6 km from Zona Franca near Golfito, along road to la Esquina.",1994.0,1,1,1,,WGS84,2019,"Kress, W. John"
28547,PRESERVED_SPECIMEN,Gonzalagunia brenesii,190633,GBIF,,Manuel Vargas,,8.67,-83.2,P. N .Esquinas. Margenes de Quebrada Gamba.,1995.0,1,1,1,,WGS84,2019,"Sánchez, Joaquín"
28549,PRESERVED_SPECIMEN,Gonzalagunia brenesii,189022,GBIF,,Manuel Vargas,,8.63,-83.18,Playa Cacao. bosqu residual atrás del manglar.,1994.0,1,1,1,,WGS84,2019,"Herrera, Gerardo"
28550,PRESERVED_SPECIMEN,Gonzalagunia brenesii,187859,GBIF,,Manuel Vargas,,8.68,-83.21,"Bosque de los Austriacos. La Gamba. Primary forest, gap near the research plot.",1994.0,1,1,1,,WGS84,2019,"Huber, Werner"
28551,PRESERVED_SPECIMEN,Gonzalagunia brenesii,165138,GBIF,,Manuel Vargas,,8.76,-83.6,Estero Guerra. Sierpe. Fincas que se encuentran al este del Estero.,1991.0,1,1,1,,WGS84,2019,"Marín, Juan"
28552,PRESERVED_SPECIMEN,Gonzalagunia brenesii,163855,GBIF,,Manuel Vargas,,8.73,-83.4,R. F. Golfo Dulce Punta Camíbar hasta Punta Islotes. Rincón de Osa.,,1,1,1,,WGS84,2019,"Aguilar, Reinaldo"
28554,PRESERVED_SPECIMEN,Gonzalagunia brenesii,141791,GBIF,,Manuel Vargas,,8.46,-83.6,"P. N. Corcovado El Tigre, Cerro Mueller.",1988.0,1,1,1,,WGS84,2019,"Kernan, C."
28555,PRESERVED_SPECIMEN,Gonzalagunia brenesii,141145,GBIF,,Manuel Vargas,,8.46,-83.6,P. N. Corcovado El Tigre. Cerro Mueller.,1988.0,1,1,1,,WGS84,2019,"Kernan, C."
28556,PRESERVED_SPECIMEN,Gonzalagunia brenesii,134306,GBIF,,Manuel Vargas,,8.68,-82.93,"Forests onmain rige and NE slopes of Fila de Cal, between San Vito and Ciudad Neilly",1985.0,1,1,1,,WGS84,2019,"Grayum, Michael"
28557,PRESERVED_SPECIMEN,Gonzalagunia brenesii,126242,GBIF,,Manuel Vargas,,9.48,-84.05,"Z.P. Cerro Nara Faldas de Cerro Nara, ca. Esquipulas, límite quepos y Tarrazú.",1987.0,1,1,1,,WGS84,2019,"Gómez Laurito, Jorge"
28560,PRESERVED_SPECIMEN,Gonzalagunia brenesii,48030,GBIF,,Manuel Vargas,,8.63,-83.16,Steep forested slopes above Golfito along the trail to the television tower.,,1,1,1,,WGS84,2019,"Burger, William"
28561,PRESERVED_SPECIMEN,Gonzalagunia brenesii,48026,GBIF,,Manuel Vargas,,8.7,-83.51,"Forested area near the airfield about 4 miles west of Rincón de Osa, Osa Península.",,1,1,1,,WGS84,2019,"Burger, William"
29178,UNKNOWN,Gonzalagunia brenesii,100080164,GBIF,,Manuel Vargas,,8.68333,-83.2167,"P.N. Piedras Blancas, way from La Gamba to Golfito",2000.0,1,1,1,,WGS84,2019,"Huber Werner, Weissenhofer Anton"
29179,UNKNOWN,Gonzalagunia brenesii,100080163,GBIF,,Manuel Vargas,,8.68333,-83.2167,"""Bosque de los Austriacos"" - La Gamba Primary forest - gap near the Research plot",1994.0,1,1,1,,WGS84,2019,"Huber Werner, Weissenhofer Anton"
29180,UNKNOWN,Gonzalagunia brenesii,100080162,GBIF,,Manuel Vargas,,8.68333,-83.2167,"P.N. Piedras Blancas, way from La Gamba to Golfito",2000.0,1,1,1,,WGS84,2019,"Huber Werner, Weissenhofer Anton"
29181,UNKNOWN,Gonzalagunia brenesii,100080161,GBIF,,Manuel Vargas,,8.68333,-83.2167,"P.N. Piedras Blancas, way from La Gamba to Golfito",2000.0,1,1,1,,WGS84,2019,"Huber Werner, Weissenhofer Anton"
