,BasisOfRec,Binomial,CatalogNo,Citation,CollectID,Compiler,Data_sens,Dec_Lat,Dec_Long,Dist_comm,Event_Year,Origin,Presence,Seasonal,Sens_comm,SpatialRef,YrCompiled,recordedBy
1963,PRESERVED_SPECIMEN,Palicourea macrosepala,U  0159115,GBIF,"Mutchnick, P; Allicock, B  523 ",Manuel Vargas,,4.716667,-59.016667000000005,,1994.0,1,1,1,,WGS84,2019,Mutchnick P; Allicock B
2883,PRESERVED_SPECIMEN,Palicourea macrosepala,100952974,GBIF,Berger AB 01021006,Manuel Vargas,,9.758611,-83.783611,"Tapanti National Park, trail from main road to river, wet montane rain forest",2010.0,1,1,1,,WGS84,2019,A. Berger
5680,PRESERVED_SPECIMEN,Palicourea macrosepala,7934,GBIF,,Manuel Vargas,,7.141,-73.0245,,2013.0,1,1,1,,WGS84,2019,J. Anaya | S. Herrera
5889,PRESERVED_SPECIMEN,Palicourea macrosepala,0067368,GBIF,,Manuel Vargas,,9.73875,-83.78222,"Costa Rica, prov. Carthago, Tapanti National Park, alongside small trail from main road to river.",2010.0,1,1,1,,WGS84,2019,"Berger,A."
5894,PRESERVED_SPECIMEN,Palicourea macrosepala,0067369,GBIF,,Manuel Vargas,,9.73875,-83.78222,"Costa Rica, prov. Carthago, Tapanti National Park, alongside small trail from main road to river.",2010.0,1,1,1,,WGS84,2019,"Berger,A."
5897,PRESERVED_SPECIMEN,Palicourea macrosepala,0067367,GBIF,,Manuel Vargas,,9.73875,-83.78222,"Costa Rica, prov. Carthago, Tapanti National Park, alongside small trail from main road to river.",2010.0,1,1,1,,WGS84,2019,"Berger,A."
6273,PRESERVED_SPECIMEN,Palicourea macrosepala,0088154,GBIF,,Manuel Vargas,,9.73667,-83.78111,"Costa Rica, Cartago Province, Canton Paraíso. Tapantí National Park, Sendero La Pava.",2013.0,1,1,1,,WGS84,2019,"Berger,A. & Schinnerl,J."
7349,PRESERVED_SPECIMEN,Palicourea macrosepala,983223,GBIF,González Ramírez 796,Manuel Vargas,,9.02,-82.86,P.I. La Amistad; Cordillera de Talamanca. Santa María de Pittier.,1995.0,1,1,1,,WGS84,2019,José Á. González R.
8671,PRESERVED_SPECIMEN,Palicourea macrosepala,544510,GBIF,Croat 67711,Manuel Vargas,,8.766667,-82.666667,"Vicinity of El Hato del Volcán at Las Lagunas, 3 miles from Nueva California, 1.7 miles past new air strip.",1987.0,1,1,1,,WGS84,2019,Thomas B. Croat
8735,PRESERVED_SPECIMEN,Palicourea macrosepala,541767,GBIF,Croat 66228A,Manuel Vargas,,8.83333,-82.63333,Along road between Volcán and Serrano; 7 mi N of Volcán; remnants of primary forest on steep slopes above highway.,1987.0,1,1,1,,WGS84,2019,Thomas B. Croat
9238,PRESERVED_SPECIMEN,Palicourea macrosepala,518066,GBIF,Hamilton 3476,Manuel Vargas,,8.833333,-82.716667,Along Río Colorado.,1983.0,1,1,1,,WGS84,2019,Clem W. Hamilton|Henry Stockwell
9260,PRESERVED_SPECIMEN,Palicourea macrosepala,517628,GBIF,Hamilton 3775,Manuel Vargas,,8.833333,-82.716667,Along Río Colorado.,1983.0,1,1,1,,WGS84,2019,Clem W. Hamilton|Karen Krager
9273,PRESERVED_SPECIMEN,Palicourea macrosepala,517146,GBIF,Hamilton 3583,Manuel Vargas,,8.783333,-82.666667,Las Lagunas area W of Hato del Volcán.,1983.0,1,1,1,,WGS84,2019,Clem W. Hamilton|Henry Stockwell
9326,PRESERVED_SPECIMEN,Palicourea macrosepala,515520,GBIF,Davidse 28430,Manuel Vargas,,9.033333,-82.983333,"Cordillera de Talamanca; area around Río Canasta, 9.5 airline km NW of Agua Caliente, between Cerro Frantzius and Cerro Pittier.",1984.0,1,1,1,,WGS84,2019,Gerrit Davidse|Gerardo Herrera Ch.|Michael H. Grayum
9332,PRESERVED_SPECIMEN,Palicourea macrosepala,515471,GBIF,Davidse 28309,Manuel Vargas,,8.991667,-82.958333,"Foothills of the Cordillera de Talamanca, between Agua Caliente and the Río Canasta.",1984.0,1,1,1,,WGS84,2019,Gerrit Davidse|Gerardo Herrera Ch.|Michael H. Grayum
9841,PRESERVED_SPECIMEN,Palicourea macrosepala,3589361,GBIF,Quesada Quesada 170,Manuel Vargas,,10.88055,-85.40138,P.N. Guanacaste. Cordillera de Guanacaste. Estación San Ramon. Dos Ríos. Sendero La Argentina.,1995.0,1,1,1,,WGS84,2019,Freddy A. Quesada
9981,PRESERVED_SPECIMEN,Palicourea macrosepala,3471715,GBIF,Mora Maroto 2,Manuel Vargas,,9.025,-82.961111,P.I. La Amistad. Cordillera de Talamanca. Estación Pittier. Sendero Fila Pittier.,1995.0,1,1,1,,WGS84,2019,Ángela Mora
9983,PRESERVED_SPECIMEN,Palicourea macrosepala,3471717,GBIF,Moraga López 19,Manuel Vargas,,9.025,-82.961111,P.I. La Amistad. Cordillera de Talamanca. Estación Pittier. La Escuadra.,1995.0,1,1,1,,WGS84,2019,Marcos Moraga
9986,PRESERVED_SPECIMEN,Palicourea macrosepala,3471711,GBIF,Picado Calvo 211,Manuel Vargas,,9.025,-82.961111,"P.I. La Amistad. Cordillera de Talamanca. Estación Pittier. Sendero Río Canasta, bosque secundario.",1995.0,1,1,1,,WGS84,2019,Annia Picado|Alexander Mora|Marcos Moraga|Billen Gamboa R.
9988,PRESERVED_SPECIMEN,Palicourea macrosepala,3471697,GBIF,Villalobos Abarca 207,Manuel Vargas,,9.025,-82.961111,"P.I. La Amistad. Cordillera de Talamanca. Estación Pittier, potreros cerca del estación.",1995.0,1,1,1,,WGS84,2019,Ronald Villalobos
10526,PRESERVED_SPECIMEN,Palicourea macrosepala,3007074,GBIF,Paul 1107,Manuel Vargas,,8.783333,-82.95,Las Cruces Biological Station.,2005.0,1,1,1,,WGS84,2019,John R. Paul
11120,PRESERVED_SPECIMEN,Palicourea macrosepala,2784154,GBIF,Alfaro Vindas 2264,Manuel Vargas,,9.037222,-82.95944399999999,"Parque Nacional La Amistad. Cuenca Terraba-Sierpe. Est. Pittier, sendero a cerro gemelo.",1999.0,1,1,1,,WGS84,2019,Evelio Alfaro
11182,PRESERVED_SPECIMEN,Palicourea macrosepala,2752898,GBIF,Utley 4537,Manuel Vargas,,9.7,-83.78,"Tapantí Hydroelectric Project, along well maintained trail to meteorological station about 6 km beyond gate",1976.0,1,1,1,,WGS84,2019,John F. Utley|K. Burt-Utley
11187,PRESERVED_SPECIMEN,Palicourea macrosepala,2750830,GBIF,Taylor 3426,Manuel Vargas,,8.781667,-82.979444,"Just south of San Vito, west of Cruces for ca. 3 km along the road running along the Fila Cruces, pasture, roadside, disturbed forest",1984.0,1,1,1,,WGS84,2019,Charlotte M. Taylor
11194,PRESERVED_SPECIMEN,Palicourea macrosepala,2750682,GBIF,Gómez-Laurito 11874,Manuel Vargas,,8.788889,-82.975,"Jardín Bot. R. & C. Wilson Coto Brus, San Vito, Las Cruces. Sendero al río, bosque aledaño al Río Jaba.",1990.0,1,1,1,,WGS84,2019,Jorge Gómez-Laurito|Quírico Jiménez|Isidro A. Chacón G.|Luis Diego Gómez P.
11195,PRESERVED_SPECIMEN,Palicourea macrosepala,2750616,GBIF,Utley 4825,Manuel Vargas,,8.79,-82.95,"OTS Field Station Finca Las Cruces, 4-5 km south of San Vito de Java",1976.0,1,1,1,,WGS84,2019,John F. Utley|K. Burt-Utley
11199,PRESERVED_SPECIMEN,Palicourea macrosepala,2750550,GBIF,Taylor 3137,Manuel Vargas,,9.67,-83.85,"Just off the Panamerican Highway along logging road to the south at Km 66, selectively logged oak forest",1984.0,1,1,1,,WGS84,2019,Charlotte M. Taylor
12222,PRESERVED_SPECIMEN,Palicourea macrosepala,2311715,GBIF,Croat 15939,Manuel Vargas,,8.826667,-82.703333,On NW side of Cerro Pando.,1971.0,1,1,1,,WGS84,2019,Thomas B. Croat
12234,PRESERVED_SPECIMEN,Palicourea macrosepala,2311260,GBIF,Tyson 870,Manuel Vargas,,8.75,-82.666667,"Las Lagunas, 2 miles SW El Volcán.",1962.0,1,1,1,,WGS84,2019,Edwin L. Tyson
12235,PRESERVED_SPECIMEN,Palicourea macrosepala,2311137,GBIF,Hammel 6844,Manuel Vargas,,8.833333,-82.733333,9 miles from Río Chiriquí Viejo bridge near Nueva California on road to Río Sereno.,1979.0,1,1,1,,WGS84,2019,Barry E. Hammel|William G. D'Arcy|E.C. Hill|S. Schwartz|O. Wolcott|H. Wolcott
12280,PRESERVED_SPECIMEN,Palicourea macrosepala,2310033,GBIF,D'Arcy 12987,Manuel Vargas,,8.828330000000001,-82.72333,Road from Nueva California and Río Serano ca. 9 mi from Río Chiriquí Viejo.,1979.0,1,1,1,,WGS84,2019,William G. D'Arcy|Barry E. Hammel|E.C. Hill|S. Schwartz|O. Wolcott|H. Wolcott
12335,PRESERVED_SPECIMEN,Palicourea macrosepala,2308716,GBIF,Croat 15939,Manuel Vargas,,8.826667,-82.703333,On NW side of Cerro Pando.,1971.0,1,1,1,,WGS84,2019,Thomas B. Croat
12358,PRESERVED_SPECIMEN,Palicourea macrosepala,2308179,GBIF,Stern 61,Manuel Vargas,,8.8,-82.6,"Foothills of Volcán Barú, nothwest of El Hato.",1957.0,1,1,1,,WGS84,2019,William L. Stern|Kenton  L. Chambers
12400,PRESERVED_SPECIMEN,Palicourea macrosepala,2307100,GBIF,Allen 986,Manuel Vargas,,8.8,-82.7,Llanos on slopes of Volcán de Chiriquí Viejo and along Río Chiriquí Viejo.,1935.0,1,1,1,,WGS84,2019,Paul H. Allen
12436,PRESERVED_SPECIMEN,Palicourea macrosepala,2305267,GBIF,Raven 21761,Manuel Vargas,,8.79,-82.95,"Cloud forest above Wilson's finca, 6 km south of San Vito de Java",1967.0,1,1,1,,WGS84,2019,Peter H. Raven
12487,PRESERVED_SPECIMEN,Palicourea macrosepala,2299713,GBIF,Pittier 585,Manuel Vargas,,3.8666669999999996,-76.916667,Dagua Valley,1905.0,1,1,1,,WGS84,2019,Henri Pittier
13591,PRESERVED_SPECIMEN,Palicourea macrosepala,1929433,GBIF,White 14,Manuel Vargas,,8.8,-82.56666700000001,Valley of the upper Río Chiriquí Viejo.,1937.0,1,1,1,,WGS84,2019,Gene White|Peggy White
14368,PRESERVED_SPECIMEN,Palicourea macrosepala,1499782,GBIF,Moraga López 571,Manuel Vargas,,9.03,-82.96,Cantón de Coto Brus P.N. La Amistad. Cuenca Térraba-Sierpa. Estación Pittier. Sendero a Río Canasta. Bosque primario.,1996.0,1,1,1,,WGS84,2019,Marcos Moraga
14710,PRESERVED_SPECIMEN,Palicourea macrosepala,1415373,GBIF,Correa A. 1478,Manuel Vargas,,8.77,-82.678333,Más a menos 5.4 Km. del Hato de Volcán en el camino a Las Lagunas.,1969.0,1,1,1,,WGS84,2019,Mireya D. Correa A.|Robert L. Lazor
15573,PRESERVED_SPECIMEN,Palicourea macrosepala,100893026,GBIF,Berger 1504,Manuel Vargas,,9.736667,-83.781111,"Tapantí National Park, Sendero La Pava.",2013.0,1,1,1,,WGS84,2019,A. Berger|J. Schinnerl
15676,PRESERVED_SPECIMEN,Palicourea macrosepala,100767924,GBIF,"Kirkbride, Jr. 994",Manuel Vargas,,8.831667,-82.253333,Bocas Del Toro-Chiriquí border. Elfin forest at divide on Chiriquicito-Calderas Trail,1968.0,1,1,1,,WGS84,2019,"Joseph H. Kirkbride, Jr.|James A. Duke"
16118,PRESERVED_SPECIMEN,Palicourea macrosepala,100501496,GBIF,Morales Quirós 12627,Manuel Vargas,,9.704167,-84.19306,"No protegida. Cuenca del Pirrís-Damas. Tiquires, sección S de Fila Ayarales, Cabeceras Río Parrita.",2005.0,1,1,1,,WGS84,2019,J. F. Morales|Daniel Santamaría
16493,PRESERVED_SPECIMEN,Palicourea macrosepala,100365353,GBIF,Pittier 11161,Manuel Vargas,,8.74,-82.94,"Valle de Agua Buena, Canas Gordas",1897.0,1,1,1,,WGS84,2019,Henri Pittier
16982,PRESERVED_SPECIMEN,Palicourea macrosepala,4450574,GBIF,,Manuel Vargas,,9.023611,-82.95611099999999,"Área de Conservación Amistad Pacífico. Parque Internacional La Amistad. Estación Pittier, Santa María de Pittier, Sendero Catarata Río Gemelo.",2015.0,1,1,1,,WGS84,2019,Nelson A. Zamora Villalobos; Roberto Espinoza ; Jose Antonio Azofeifa Zuñiga ; Róger Gutiérrez
16986,PRESERVED_SPECIMEN,Palicourea macrosepala,4450573,GBIF,,Manuel Vargas,,9.023611,-82.95611099999999,"Área de Conservación Amistad Pacífico. Parque Internacional La Amistad. Estación Pittier, Santa María de Pittier, Sendero Catarata Río Gemelo.",2015.0,1,1,1,,WGS84,2019,Nelson A. Zamora Villalobos; Roberto Espinoza ; Jose Antonio Azofeifa Zuñiga ; Róger Gutiérrez
16987,PRESERVED_SPECIMEN,Palicourea macrosepala,4450572,GBIF,,Manuel Vargas,,9.023611,-82.95611099999999,"Área de Conservación Amistad Pacífico. Parque Internacional La Amistad. Estación Pittier, Santa María de Pittier, Sendero Catarata Río Gemelo.",2015.0,1,1,1,,WGS84,2019,Nelson A. Zamora Villalobos; Roberto Espinoza ; Jose Antonio Azofeifa Zuñiga ; Róger Gutiérrez
17983,PRESERVED_SPECIMEN,Palicourea macrosepala,4191105,GBIF,,Manuel Vargas,,10.0275,-83.924722,"Coronado. Cascajal, La Isla.",2000.0,1,1,1,,WGS84,2019,Luis Diego Vargas; Guillermo Villalobos
17985,PRESERVED_SPECIMEN,Palicourea macrosepala,4191106,GBIF,,Manuel Vargas,,10.0275,-83.924722,"Coronado. Cascajal, La Isla.",2000.0,1,1,1,,WGS84,2019,Luis Diego Vargas; Guillermo Villalobos
18359,PRESERVED_SPECIMEN,Palicourea macrosepala,4113203,GBIF,,Manuel Vargas,,9.537222,-83.83833299999999,"Dota, Providencia, Zapotal. Finca propiedad de Joyce Zurcher.",2003.0,1,1,1,,WGS84,2019,Alexánder Francisco Rodríguez González; Armando Ruiz ; Silvia Lobo
18360,PRESERVED_SPECIMEN,Palicourea macrosepala,4113204,GBIF,,Manuel Vargas,,9.537222,-83.83833299999999,"Dota, Providencia, Zapotal. Finca propiedad de Joyce Zurcher.",2003.0,1,1,1,,WGS84,2019,Alexánder Francisco Rodríguez González; Armando Ruiz ; Silvia Lobo
18361,PRESERVED_SPECIMEN,Palicourea macrosepala,4113200,GBIF,,Manuel Vargas,,9.537222,-83.83833299999999,"Dota, Providencia, Zapotal. Finca propiedad de Joyce Zurcher.",2003.0,1,1,1,,WGS84,2019,Alexánder Francisco Rodríguez González; Armando Ruiz ; Silvia Lobo
18362,PRESERVED_SPECIMEN,Palicourea macrosepala,4113202,GBIF,,Manuel Vargas,,9.537222,-83.83833299999999,"Dota, Providencia, Zapotal. Finca propiedad de Joyce Zurcher.",2003.0,1,1,1,,WGS84,2019,Alexánder Francisco Rodríguez González; Armando Ruiz ; Silvia Lobo
18363,PRESERVED_SPECIMEN,Palicourea macrosepala,4113201,GBIF,,Manuel Vargas,,9.537222,-83.83833299999999,"Dota, Providencia, Zapotal. Finca propiedad de Joyce Zurcher.",2003.0,1,1,1,,WGS84,2019,Alexánder Francisco Rodríguez González; Armando Ruiz ; Silvia Lobo
18951,PRESERVED_SPECIMEN,Palicourea macrosepala,4064178,GBIF,,Manuel Vargas,,9.704167,-84.193056,"Tiquires, sección S de Fila Ayarales, Cabeceras Río Parrita.",2005.0,1,1,1,,WGS84,2019,Juan Francisco Morales Quirós; Daniel Santamaría
18952,PRESERVED_SPECIMEN,Palicourea macrosepala,4064180,GBIF,,Manuel Vargas,,9.704167,-84.193056,"Tiquires, sección S de Fila Ayarales, Cabeceras Río Parrita.",2005.0,1,1,1,,WGS84,2019,Juan Francisco Morales Quirós; Daniel Santamaría
18953,PRESERVED_SPECIMEN,Palicourea macrosepala,4064177,GBIF,,Manuel Vargas,,9.704167,-84.193056,"Tiquires, sección S de Fila Ayarales, Cabeceras Río Parrita.",2005.0,1,1,1,,WGS84,2019,Juan Francisco Morales Quirós; Daniel Santamaría
18955,PRESERVED_SPECIMEN,Palicourea macrosepala,4064179,GBIF,,Manuel Vargas,,9.704167,-84.193056,"Tiquires, sección S de Fila Ayarales, Cabeceras Río Parrita.",2005.0,1,1,1,,WGS84,2019,Juan Francisco Morales Quirós; Daniel Santamaría
21371,PRESERVED_SPECIMEN,Palicourea macrosepala,2915687,GBIF,,Manuel Vargas,,8.788889,-82.975,"Coto Brus, San Vito, Las Cruces. Sendero al rio, bosque aledano al Rio Jaba.",1990.0,1,1,1,,WGS84,2019,Jorge Gómez Laurito
22187,PRESERVED_SPECIMEN,Palicourea macrosepala,2845525,GBIF,,Manuel Vargas,,9.037413,-82.959489,"Send. a Cerro Pittier, 1.5 Km N. de la Estacion",1999.0,1,1,1,,WGS84,2019,Evelio Alfaro
22188,PRESERVED_SPECIMEN,Palicourea macrosepala,2845527,GBIF,,Manuel Vargas,,9.037413,-82.959489,"Send. a Cerro Pittier, 1.5 Km N. de la Estacion",1999.0,1,1,1,,WGS84,2019,Evelio Alfaro
22189,PRESERVED_SPECIMEN,Palicourea macrosepala,2845526,GBIF,,Manuel Vargas,,9.037413,-82.959489,"Send. a Cerro Pittier, 1.5 Km N. de la Estacion",1999.0,1,1,1,,WGS84,2019,Evelio Alfaro
22647,PRESERVED_SPECIMEN,Palicourea macrosepala,1605613,GBIF,,Manuel Vargas,,9.027222,-82.86555600000001,Santa Maria de Pittier.,1995.0,1,1,1,,WGS84,2019,Jose González
22656,PRESERVED_SPECIMEN,Palicourea macrosepala,1605422,GBIF,,Manuel Vargas,,9.025,-82.961113,"Estacion Pittier, potreros cerca de la estacion.",1995.0,1,1,1,,WGS84,2019,Ronald Villalobos
22683,PRESERVED_SPECIMEN,Palicourea macrosepala,1605173,GBIF,,Manuel Vargas,,9.025,-82.961112,"Estacion Pittier. Sendero Rio Canasta, bosque secundario.",1995.0,1,1,1,,WGS84,2019,Annia Picado
22689,PRESERVED_SPECIMEN,Palicourea macrosepala,1605140,GBIF,,Manuel Vargas,,9.025,-82.961114,Estacion Pittier. Sendero Fila Pittier.,1995.0,1,1,1,,WGS84,2019,Angela Mora Maroto
23022,PRESERVED_SPECIMEN,Palicourea macrosepala,1589846,GBIF,,Manuel Vargas,,9.040128999999999,-82.961079,P.N. La Amistad. Estación Pittier.,1995.0,1,1,1,,WGS84,2019,Luis Angulo
23248,PRESERVED_SPECIMEN,Palicourea macrosepala,1573109,GBIF,,Manuel Vargas,,8.788889,-82.977778,Bosque cerca del Jardin. Secondary forest.,1992.0,1,1,1,,WGS84,2019,Debon Graham
24163,PRESERVED_SPECIMEN,Palicourea macrosepala,1520437,GBIF,,Manuel Vargas,,9.031989999999999,-82.960864,Estación Pittier,1996.0,1,1,1,,WGS84,2019,Marcos Moraga
24164,PRESERVED_SPECIMEN,Palicourea macrosepala,1520436,GBIF,,Manuel Vargas,,9.031989999999999,-82.960864,Estación Pittier,1996.0,1,1,1,,WGS84,2019,Marcos Moraga
24165,PRESERVED_SPECIMEN,Palicourea macrosepala,1520438,GBIF,,Manuel Vargas,,9.031989999999999,-82.960864,Estación Pittier,1996.0,1,1,1,,WGS84,2019,Marcos Moraga
24166,PRESERVED_SPECIMEN,Palicourea macrosepala,1520435,GBIF,,Manuel Vargas,,9.031989999999999,-82.960864,Estación Pittier,1996.0,1,1,1,,WGS84,2019,Marcos Moraga
24297,PRESERVED_SPECIMEN,Palicourea macrosepala,V0069877F,GBIF,14,Manuel Vargas,,8.5714,-79.9106,,1937.0,1,1,1,,WGS84,2019,G. White & P. White
24380,PRESERVED_SPECIMEN,Palicourea macrosepala,,GBIF,11161,Manuel Vargas,,10.0114,-83.9519,,1897.0,1,1,1,,WGS84,2019,H. F. Pittier
24561,PRESERVED_SPECIMEN,Palicourea macrosepala,V0069872F,GBIF,7704,Manuel Vargas,,10.0114,-83.9519,,,1,1,1,,WGS84,2019,A. Tonduz
24947,PRESERVED_SPECIMEN,Palicourea macrosepala,V0069867F,GBIF,11161,Manuel Vargas,,10.0114,-83.9519,,1897.0,1,1,1,,WGS84,2019,H. F. Pittier
24952,PRESERVED_SPECIMEN,Palicourea macrosepala,,GBIF,7704,Manuel Vargas,,10.0114,-83.9519,,,1,1,1,,WGS84,2019,A. Tonduz
25130,PRESERVED_SPECIMEN,Palicourea macrosepala,,GBIF,1478,Manuel Vargas,,8.5,-82.25,,1969.0,1,1,1,,WGS84,2019,M. D. Corrêa A.
26434,PRESERVED_SPECIMEN,Palicourea macrosepala,820,GBIF,,Manuel Vargas,,8.783222,-82.976556,,,1,1,1,,WGS84,2019,
