,BasisOfRec,Binomial,CatalogNo,Citation,CollectID,Compiler,Data_sens,Dec_Lat,Dec_Long,Dist_comm,Event_Year,Origin,Presence,Seasonal,Sens_comm,SpatialRef,YrCompiled,recordedBy
26933,PRESERVED_SPECIMEN,Symplocos serrulata,195198,GBIF,,Manuel Vargas,,9.52,-83.59,"P. N. Chirripó Cordillera de Talamanca.- Finca San Carlos, entre las cabeceras de las quebradas Blanco y  Barranca.",1995.0,1,1,1,,WGS84,2019,"González, José"
26934,PRESERVED_SPECIMEN,Symplocos serrulata,193148,GBIF,,Manuel Vargas,,9.85,-84.12,"Z.P. Cerros de Escazú Cedral, vereda entre Alto Hierbabuena y Poás, bosque secundario.",1992.0,1,1,1,,WGS84,2019,"Morales, Juan Francisco"
26935,PRESERVED_SPECIMEN,Symplocos serrulata,192888,GBIF,,Manuel Vargas,,9.84,-84.14,"Z.P. Cerros de Escazú Cedral, Cerro Rabo de Mico, bosque secundario.",1991.0,1,1,1,,WGS84,2019,"Morales, Juan Francisco"
26937,PRESERVED_SPECIMEN,Symplocos serrulata,188800,GBIF,,Manuel Vargas,,9.84,-84.12,Z.P. Cerros de Escazú Cedral y Alto Hierbabuena.,1993.0,1,1,1,,WGS84,2019,"Ramírez, Victor H."
26938,PRESERVED_SPECIMEN,Symplocos serrulata,187189,GBIF,,Manuel Vargas,,10.12,-84.12,P.N. Braulio Carrillo Estación Barva. Bosque primario y potreros.,1990.0,1,1,1,,WGS84,2019,"Varela, Gerardo"
26939,PRESERVED_SPECIMEN,Symplocos serrulata,183013,GBIF,,Manuel Vargas,,8.66,-81.75,"Provincia Chiriquí-Bocas del Toro boundary, Cerro Colorado area, wet forest on windswept ridge.",1989.0,1,1,1,,WGS84,2019,G. de Nevers
26941,PRESERVED_SPECIMEN,Symplocos serrulata,181823,GBIF,,Manuel Vargas,,9.35,-83.22,P.I. La Amistad Cordillera de Talamanca.300 m antes de unión quebrada Kuisa con R. Lori. Entre Ujarrás -San José Cabécar.,1993.0,1,1,1,,WGS84,2019,"Herrera, Gerardo"
26942,PRESERVED_SPECIMEN,Symplocos serrulata,179690,GBIF,,Manuel Vargas,,10.12,-84.1,P.N. Braulio Carrillo Volcán Barva.,1989.0,1,1,1,,WGS84,2019,"Rivera, Gerardo"
26943,PRESERVED_SPECIMEN,Symplocos serrulata,179564,GBIF,,Manuel Vargas,,10.13,-84.11,P.N. Braulio Carrillo Estación Barva.,1990.0,1,1,1,,WGS84,2019,"Fernández, Álvaro"
26944,PRESERVED_SPECIMEN,Symplocos serrulata,177304,GBIF,,Manuel Vargas,,10.13,-84.1,"P.N. Braulio Carrillo Upper Volcán Barva, Atlantic slope, ca. 0.5 km below (to N of ) main trail to laguna Barva, descending vía old Sendero del transecto then traversing 250 m directly east. Treeplot 2750-3",1992.0,1,1,1,,WGS84,2019,"Boyle, Brad"
26945,PRESERVED_SPECIMEN,Symplocos serrulata,177303,GBIF,,Manuel Vargas,,10.12,-84.12,"P.N. Braulio Carrillo Upper Volcán Barva, Pacific slope, near divide. At edge of main trail from guard house to Laguna Barva.",1992.0,1,1,1,,WGS84,2019,"Boyle, Brad"
26946,PRESERVED_SPECIMEN,Symplocos serrulata,171645,GBIF,,Manuel Vargas,,10.12,-84.12,P.N. Braulio Carrillo Estación Barva. Bosque primario y potreros.,1990.0,1,1,1,,WGS84,2019,"Varela, Gerardo"
26947,PRESERVED_SPECIMEN,Symplocos serrulata,165074,GBIF,,Manuel Vargas,,10.21,-84.61,R. F. San Ramon Sendero al SO del río.,1993.0,1,1,1,,WGS84,2019,"Gómez Laurito, Jorge"
26949,PRESERVED_SPECIMEN,Symplocos serrulata,163314,GBIF,,Manuel Vargas,,9.84,-84.14,"Z.P. Cerros de Escazú Cedral, bosque primario y secundario em la falda norte del cerro Rabo de Mico. Cuenca del Río Poás.",1991.0,1,1,1,,WGS84,2019,"Morales, Juan Francisco"
26951,PRESERVED_SPECIMEN,Symplocos serrulata,147329,GBIF,,Manuel Vargas,,9.55,-83.71,Villa Mills.,1990.0,1,1,1,,WGS84,2019,"Hernández, Daniel"
26952,PRESERVED_SPECIMEN,Symplocos serrulata,147150,GBIF,,Manuel Vargas,,9.55,-83.71,Villa Mills.,1990.0,1,1,1,,WGS84,2019,"Hernández, Daniel"
26959,PRESERVED_SPECIMEN,Symplocos serrulata,129560,GBIF,,Manuel Vargas,,9.57,-83.75,R.F. Los Santos Cerro Asunción.,1986.0,1,1,1,,WGS84,2019,"Kappelle, Maarten"
26960,PRESERVED_SPECIMEN,Symplocos serrulata,129354,GBIF,,Manuel Vargas,,9.56,-83.7,"R.F. Los Santos La Georgina de Villa MIlls, c. 1.5 km al norte del restaurante ""La Georgina"", Carrtera Interamericana (Km 95).",1986.0,1,1,1,,WGS84,2019,"Kappelle, Maarten"
26961,PRESERVED_SPECIMEN,Symplocos serrulata,125319,GBIF,,Manuel Vargas,,9.13,-82.96,"Atlantic slope, Valle del Silencio, area just N of Cerro Hoffman4-1/2 airline km W of the Costarican Panamanian border.",1984.0,1,1,1,,WGS84,2019,"Davidse, Gerrit"
26962,PRESERVED_SPECIMEN,Symplocos serrulata,124874,GBIF,,Manuel Vargas,,9.56,-83.75,"La Georgina, Cerro de la Muerte.",1987.0,1,1,1,,WGS84,2019,"Zamora, Nelson"
26963,PRESERVED_SPECIMEN,Symplocos serrulata,122548,GBIF,,Manuel Vargas,,9.86,-84.15,Z.P. Cerros de Escazú Lower montane wet forest.,1975.0,1,1,1,,WGS84,2019,"Utley, John F."
26964,PRESERVED_SPECIMEN,Symplocos serrulata,119413,GBIF,,Manuel Vargas,,9.68,-83.9,La Cima.,1985.0,1,1,1,,WGS84,2019,"Chavarría, María Marta"
26965,PRESERVED_SPECIMEN,Symplocos serrulata,117363,GBIF,,Manuel Vargas,,9.68,-83.9,La Cima.,1985.0,1,1,1,,WGS84,2019,"Chavarría, María Marta"
26966,PRESERVED_SPECIMEN,Symplocos serrulata,117360,GBIF,,Manuel Vargas,,9.68,-83.9,La Cima.,1985.0,1,1,1,,WGS84,2019,"Chavarría, María Marta"
26967,PRESERVED_SPECIMEN,Symplocos serrulata,116811,GBIF,,Manuel Vargas,,9.86,-84.15,Z.P. Cerros de Escazú About 6-8 km SSW of San José in the Cerros de Escazú. Lower montane wet forest.,1975.0,1,1,1,,WGS84,2019,"Utley, John F."
26968,PRESERVED_SPECIMEN,Symplocos serrulata,112775,GBIF,,Manuel Vargas,,9.68,-83.9,La Cima.,1985.0,1,1,1,,WGS84,2019,"Chavarría, María Marta"
26969,PRESERVED_SPECIMEN,Symplocos serrulata,108971,GBIF,,Manuel Vargas,,9.2,-82.98,North Slope of the unnamed cordillera between the río Teribe and the río Sini,1984.0,1,1,1,,WGS84,2019,"Davidse, Gerrit"
26970,PRESERVED_SPECIMEN,Symplocos serrulata,108948,GBIF,,Manuel Vargas,,9.2,-82.98,"Atlantic slope, unnamend cordillera between the r.io Terbi and río Siní.",1984.0,1,1,1,,WGS84,2019,"Davidse, Gerrit"
26971,PRESERVED_SPECIMEN,Symplocos serrulata,107454,GBIF,,Manuel Vargas,,9.17,-83.05,"Head-waters of the unnamed wertern branch of the río Teribe, between the río Sini and the continental divide at Cerro Bekon.",1984.0,1,1,1,,WGS84,2019,"Davidse, Gerrit"
26972,PRESERVED_SPECIMEN,Symplocos serrulata,107423,GBIF,,Manuel Vargas,,9.17,-83.05,"Head-waters of the unnamed wertern branch of the río Teribe, between the río Sini and the continental divide at Cerro Bekon.",1984.0,1,1,1,,WGS84,2019,"Davidse, Gerrit"
26973,PRESERVED_SPECIMEN,Symplocos serrulata,106353,GBIF,,Manuel Vargas,,9.0,-82.81,Cordillera de Talamanca.1-3 airline km S of the peak of cerro Echandi. Quercus forest with Chusquea understory.,1984.0,1,1,1,,WGS84,2019,"Davidse, Gerrit"
26974,PRESERVED_SPECIMEN,Symplocos serrulata,105230,GBIF,,Manuel Vargas,,9.08,-82.84,"Headwaters of the río Culubre, 6 airline km NW the peak of Cerro Echandi on the Costa Rican international border.",1984.0,1,1,1,,WGS84,2019,"Davidse, Gerrit"
26975,PRESERVED_SPECIMEN,Symplocos serrulata,99197,GBIF,,Manuel Vargas,,9.56,-83.66,"E.B. Cuericí Upper slopes, western ridge of Cerros Cuericí.",1983.0,1,1,1,,WGS84,2019,"Davidse, Gerrit"
26978,PRESERVED_SPECIMEN,Symplocos serrulata,183722,GBIF,,Manuel Vargas,,9.56,-83.75,"La Georgina, Cerro de la Muerte.",1987.0,1,1,1,,WGS84,2019,"Zamora, Nelson"
